{
  "schema_version": "1.0.0",
  "ledger_id": "forecast-ledger-demo-001",
  "research": {
    "research_id": "research-demo-001",
    "research_version": "1.0.0"
  },
  "created_at": "2026-08-30T08:00:10Z",
  "forecasts": [
    {
      "forecast_id": "forecast-001",
      "forecast_revision": 1,
      "claim_id": "claim-forecast-001",
      "run_id": "11111111-1111-4111-8111-111111111111",
      "hypothesis_ref": "H1",
      "supersedes_forecast_id": null,
      "issued_at": "2026-08-30T08:00:10Z",
      "as_of": "2026-08-30T08:00:00Z",
      "target": {
        "target_object": "Demonstration market",
        "target_variable": "Direction of the daily return",
        "unit": "Category",
        "population": "Next complete trading session"
      },
      "window": {
        "horizon_description": "One complete trading session after issuance",
        "starts_at": "2026-08-31T07:00:00Z",
        "ends_at": "2026-08-31T15:30:00Z",
        "resolution_deadline": "2026-09-01T12:00:00Z"
      },
      "prediction": {
        "kind": "DIRECTION",
        "point_value": null,
        "lower_bound": null,
        "upper_bound": null,
        "direction": "UP",
        "category": null,
        "probability": null,
        "calibration_ref": null
      },
      "evidence_at_issue": {
        "evidence_set_id": "22222222-2222-4222-8222-222222222222",
        "evidence_grade": "LIMITED",
        "ruleset_version": "1.0.0"
      },
      "resolution_plan": {
        "expected_source_refs": [
          "official-close-dataset"
        ],
        "resolution_rule": "UP if the official close is strictly above the official open; otherwise DOWN or FLAT according to the sign.",
        "scheduled_at": "2026-09-01T08:00:00Z",
        "scoring_rule": "DIRECTION_ACCURACY",
        "custom_scoring_rule": null
      },
      "status": "OPEN",
      "resolution": null,
      "record_hash": "eeeeeeeeeeeeeeeeeeeeeeeeeeeeeeeeeeeeeeeeeeeeeeeeeeeeeeeeeeeeeeee"
    }
  ]
}
